{
  "schema_version": "experience-storage-record-v0",
  "record_class": "redacted_private_experience_record",
  "domain": "career_private",
  "subject": {
    "type": "company",
    "public_name": "Example Company",
    "aliases": ["Example Co"],
    "entity_name_public_allowed": true,
    "private_person_refs": []
  },
  "storage_state": {
    "mode": "stored_private_redacted",
    "activation_required": false,
    "database_write_enabled": true,
    "record_visible_to_retrieval": false
  },
  "consent": {
    "capture_notice_shown": true,
    "revocation_supported": true,
    "publication_consent": false,
    "b2b_contact_consent": false,
    "dashboard_aggregation_consent": false,
    "private_retention_consent_proof": {
      "consent_id": "11111111-1111-4111-8111-111111111111",
      "handoff_id": "22222222-2222-4222-8222-222222222222",
      "challenge_id": "33333333-3333-4333-8333-333333333333",
      "card_id": "44444444-4444-4444-8444-444444444444",
      "card_version_id": "55555555-5555-4555-8555-555555555555",
      "artifact_digest": "sha256:aaaaaaaaaaaaaaaaaaaaaaaaaaaaaaaaaaaaaaaaaaaaaaaaaaaaaaaaaaaaaaaa",
      "policy_version": "private-retention-v1",
      "policy_digest": "sha256:bbbbbbbbbbbbbbbbbbbbbbbbbbbbbbbbbbbbbbbbbbbbbbbbbbbbbbbbbbbbbbbb",
      "challenge_digest": "sha256:eeeeeeeeeeeeeeeeeeeeeeeeeeeeeeeeeeeeeeeeeeeeeeeeeeeeeeeeeeeeeeee",
      "handoff_digest": "sha256:ffffffffffffffffffffffffffffffffffffffffffffffffffffffffffffffff"
    }
  },
  "redacted_experience": {
    "title": "Interview process felt slow",
    "summary": "A redacted career experience record that keeps the company name but removes selection status, people, dates, and raw messages.",
    "observations": [
      "The process cadence felt slower than expected.",
      "The role explanation was useful but operational details were unclear."
    ],
    "subjective_impressions": [
      "The experience felt somewhat disorganized from the candidate side."
    ],
    "disallowed_detail_classes": [
      "selection_status",
      "private_message",
      "private_person_identity",
      "exact_timestamp",
      "raw_source_material",
      "protected_identity_signal",
      "device_or_network_signal"
    ],
    "private_selection_status_present": false,
    "raw_quotes_present": false,
    "exact_dates_present": false,
    "private_person_present": false
  },
  "source_controls": {
    "raw_source_retention": "none",
    "raw_detail_escrow_ref": null,
    "raw_source_available_to_model": false,
    "source_digest": "sha256:aaaaaaaaaaaaaaaaaaaaaaaaaaaaaaaaaaaaaaaaaaaaaaaaaaaaaaaaaaaaaaaa"
  },
  "surface_controls": {
    "retrieval_policy": "explicit_or_contextual",
    "public_candidate_conversion_enabled": false,
    "public_serving_enabled": false,
    "b2b_delivery_enabled": false,
    "identity_processing_enabled": false,
    "raw_detail_escrow_enabled": false,
    "dashboard_enabled": false
  },
  "audit": {
    "actor_ref": "operator-private:reviewer-001",
    "created_at": "operator-time:experience-storage-redacted-001",
    "redaction_digest": "sha256:dddddddddddddddddddddddddddddddddddddddddddddddddddddddddddddddd",
    "redaction_notes": "Company name is retained; selection detail, people, exact dates, raw messages, and device signals are removed."
  }
}
